sentence,label
so Migrate the payment gateway by tomorrow,1
so Please Improve the notification service as soon as possible,1
so This decision is still pending.,0
so Sakshi mentioned the login bug yesterday.,0
We need to Patch the UI components before next release,1
um Nothing actionable at the moment.,0
uh Please Add the monitoring dashboard by Friday,1
um Can someone Configure user authentication?,1
um Configure the analytics API needs to be done by Friday,1
so Write database performance for the next sprint,1
um The database performance improved yesterday.,0
so Let's Improve the recommendation engine as soon as possible,1
Let's Implement database performance before next release,1
so Create the analytics API urgently please,1
um Someone updated the payment gateway earlier.,0
so This requires additional approval.,0
like Let's Implement the monitoring dashboard due this week,1
like We will discuss this again tomorrow.,0
so Let’s wait for stakeholder feedback.,0
um We should wait for product input.,0
Please Patch the monitoring dashboard by tomorrow,1
uh Let's Add logging system as soon as possible,1
like Nothing actionable at the moment.,0
like This is still under review.,0
uh Please Resolve unit tests before next release,1
so Someone should Refactor data migration script as soon as possible,1
like Integrate the notification service due this week,1
uh This is still under review.,0
like We need to Design data migration script urgently,1
uh Can someone Patch the search indexing logic as soon as possible?,1
uh Someone updated the payment gateway earlier.,0
so Design database performance by Friday please,1
uh Someone updated the payment gateway earlier.,0
uh Can someone Improve the recommendation engine as soon as possible?,1
like Someone should Develop user authentication,1
so We reviewed the API documentation last week.,0
so Let's Update the login bug by tomorrow,1
um This is still under review.,0
like We should Design logging system urgently,1
so We will discuss this again tomorrow.,0
uh Optimize the search indexing logic please,1
uh We will revisit this topic later.,0
uh There is no blocker right now.,0
uh Build the payment gateway before next release,1
uh We can postpone this to next sprint.,0
Optimize the payment gateway by Friday,1
uh Please Build the UI components,1
This is still under review.,0
um Optimize onboarding screen as soon as possible please,1
uh It would be good to Optimize onboarding screen due this week,1
so It would be good to Optimize database performance by Friday,1
uh Someone should Create the login bug due this week,1
um It would be good to Develop user authentication urgently,1
uh We will discuss this again tomorrow.,0
like There is no blocker right now.,0
like We need more information before proceeding.,0
Someone updated the payment gateway earlier.,0
um Debug the caching layer needs to be done due this week,1
um This will be discussed next week.,0
so It would be good to Design the recommendation engine by tomorrow,1
like This requires additional approval.,0
uh This will be discussed next week.,0
Enhance the caching layer needs to be done by Friday,1
We should analyze this further.,0
so We will revisit this topic later.,0
so Can someone Patch the payment gateway due this week?,1
um We need to Optimize the analytics API by Friday,1
like Write unit tests before next release please,1
It would be good to Create the payment gateway due this week,1
Let’s wait for stakeholder feedback.,0
um The database performance improved yesterday.,0
uh Arjun designed the onboarding screens last month.,0
so Design logging system due this week please,1
uh Please Fix logging system,1
so We should wait for product input.,0
so This depends on future planning.,0
uh We should analyze this further.,0
uh Let's Design the notification service urgently,1
so It would be good to Develop API documentation by Friday,1
so Design onboarding screen needs to be done before next release,1
so Let's Design the recommendation engine for the next sprint,1
Please Write user authentication due this week,1
uh Improve user authentication as soon as possible,1
like Design the notification service by Friday,1
um Add the search indexing logic,1
so The team optimized the caching layer before.,0
like We need to Implement the caching layer by tomorrow,1
Can someone Configure the mobile layout urgently?,1
We should Implement the caching layer,1
uh Sakshi mentioned the login bug yesterday.,0
uh Integrate unit tests needs to be done by tomorrow,1
uh We will discuss this again tomorrow.,0
so We should Create the UI components due this week,1
uh This is still under review.,0
like Please Optimize the payment gateway due this week,1
uh Please Debug onboarding screen due this week,1
um We need to Integrate the monitoring dashboard due this week,1
like Someone should Design the notification service as soon as possible,1
It would be good to Patch the UI components as soon as possible,1
so It would be good to Configure unit tests for the next sprint,1
like We should Refactor the mobile layout urgently,1
um Debug user authentication needs to be done urgently,1
uh Someone should Patch onboarding screen before next release,1
so The database performance improved yesterday.,0
uh Let's Write the login bug due this week,1
uh This depends on future planning.,0
uh It would be good to Configure the monitoring dashboard as soon as possible,1
um We need to Enhance the payment gateway due this week,1
um This requires additional approval.,0
uh There is no blocker right now.,0
uh We should wait for product input.,0
um Create the payment gateway urgently please,1
This requires additional approval.,0
um Let's Enhance API documentation,1
so We can postpone this to next sprint.,0
so We need to Refactor database performance urgently,1
so Refactor onboarding screen before next release,1
um Implement user authentication please,1
like We will revisit this topic later.,0
Nothing actionable at the moment.,0
um We will discuss this again tomorrow.,0
like It would be good to Fix the analytics API as soon as possible,1
We should Configure the search indexing logic as soon as possible,1
Migrate unit tests as soon as possible,1
We need more information before proceeding.,0
uh Can someone Configure the notification service for the next sprint?,1
so The team optimized the caching layer before.,0
so Let's Update the monitoring dashboard before next release,1
um We should collect more data first.,0
like It would be good to Migrate data migration script before next release,1
um We should Write the analytics API for the next sprint,1
uh Please Develop user authentication by tomorrow,1
um This decision is still pending.,0
um Fix logging system needs to be done due this week,1
uh We need to Refactor the search indexing logic as soon as possible,1
uh Let's Debug the monitoring dashboard,1
um This requires additional approval.,0
Migrate unit tests needs to be done,1
um The database performance improved yesterday.,0
um Add the caching layer needs to be done before next release,1
like Add onboarding screen needs to be done due this week,1
uh This is not a priority currently.,0
uh Please Configure the notification service for the next sprint,1
um We need design approval first.,0
We need to Enhance unit tests before next release,1
like Configure the caching layer needs to be done as soon as possible,1
um Please Build the recommendation engine by tomorrow,1
Resolve user authentication needs to be done urgently,1
um We should Debug onboarding screen urgently,1
um There is no urgency for this item.,0
uh We reviewed the API documentation last week.,0
um This decision is still pending.,0
so Please Implement the login bug by tomorrow,1
like Design the mobile layout needs to be done as soon as possible,1
like Someone should Create the monitoring dashboard urgently,1
um Create unit tests for the next sprint,1
um We need to Migrate the UI components,1
like Someone should Update the notification service before next release,1
like We should Implement data migration script due this week,1
uh Build unit tests needs to be done due this week,1
uh No action items were mentioned.,0
We can postpone this to next sprint.,0
uh Improve the UI components as soon as possible please,1
like No action items were mentioned.,0
like We should analyze this further.,0
We need to Write data migration script by tomorrow,1
like Can someone Debug database performance for the next sprint?,1
um The team is still evaluating this.,0
like It would be good to Develop onboarding screen before next release,1
uh The login bug was fixed previously.,0
Can someone Build the monitoring dashboard for the next sprint?,1
We should collect more data first.,0
like We should collect more data first.,0
um The team optimized the caching layer before.,0
We should collect more data first.,0
Can someone Optimize the mobile layout by Friday?,1
Arjun designed the onboarding screens last month.,0
so Please Add data migration script by Friday,1
um It would be good to Design unit tests before next release,1
Migrate user authentication needs to be done for the next sprint,1
um Someone should Add the notification service for the next sprint,1
so The team is still evaluating this.,0
um Someone should Update session management urgently,1
uh We need to Debug data migration script,1
so It would be good to Integrate user authentication as soon as possible,1
We should Migrate the payment gateway by Friday,1
Can someone Create the recommendation engine due this week?,1
um We should Update logging system as soon as possible,1
like We should Patch the UI components,1
um It would be good to Resolve the mobile layout,1
uh Arjun designed the onboarding screens last month.,0
like We should Refactor API documentation urgently,1
like Let's Create the search indexing logic,1
so We should Develop the recommendation engine urgently,1
uh We will discuss this again tomorrow.,0
This will be discussed next week.,0
so It would be good to Optimize the monitoring dashboard by Friday,1
like Sakshi mentioned the login bug yesterday.,0
This will be discussed next week.,0
uh We should Write the search indexing logic due this week,1
so There is no blocker right now.,0
uh Can someone Improve API documentation as soon as possible?,1
like Let's Refactor database performance by Friday,1
so Integrate the recommendation engine needs to be done for the next sprint,1
like This is not a priority currently.,0
uh We need design approval first.,0
like The team is still evaluating this.,0
so It would be good to Fix the payment gateway,1
so We should Update onboarding screen by Friday,1
We should Enhance user authentication as soon as possible,1
like Let’s wait for stakeholder feedback.,0
like The database performance improved yesterday.,0
We will discuss this again tomorrow.,0
We need more information before proceeding.,0
um It would be good to Patch database performance by Friday,1
like This is not a priority currently.,0
uh We should Create the mobile layout by tomorrow,1
This requires additional approval.,0
like Configure the monitoring dashboard due this week please,1
Develop the payment gateway for the next sprint please,1
like Arjun designed the onboarding screens last month.,0
um We should Integrate session management before next release,1
uh We need to Optimize unit tests by Friday,1
so Arjun designed the onboarding screens last month.,0
um Migrate database performance as soon as possible,1
like We should Write API documentation before next release,1
um Someone updated the payment gateway earlier.,0
uh We need to Enhance the recommendation engine due this week,1
so Someone should Patch the caching layer by Friday,1
uh We need to Fix logging system for the next sprint,1
uh This depends on future planning.,0
like Add session management by tomorrow please,1
like We need more information before proceeding.,0
like Fix the mobile layout please,1
uh Patch the recommendation engine needs to be done by tomorrow,1
like Someone should Write onboarding screen by tomorrow,1
um The login bug was fixed previously.,0
so Someone should Update the mobile layout due this week,1
uh Enhance the payment gateway by tomorrow,1
uh Please Optimize the payment gateway due this week,1
like Sakshi mentioned the login bug yesterday.,0
We should analyze this further.,0
uh Can someone Patch onboarding screen as soon as possible?,1
uh This depends on future planning.,0
uh Can someone Add the recommendation engine?,1
so Migrate the UI components needs to be done,1
um Let’s wait for stakeholder feedback.,0
We should collect more data first.,0
uh This is still under review.,0
like Let’s wait for stakeholder feedback.,0
uh We need to Write the search indexing logic,1
so Please Update onboarding screen by tomorrow,1
Nothing actionable at the moment.,0
The team is still evaluating this.,0
um This depends on future planning.,0
This requires additional approval.,0
like Please Configure session management due this week,1
uh We need more information before proceeding.,0
We need more information before proceeding.,0
Someone should Build the analytics API by Friday,1
um Let's Migrate the payment gateway for the next sprint,1
like Someone should Integrate the analytics API for the next sprint,1
like Mohit worked on database performance last sprint.,0
We need to Develop data migration script urgently,1
like Someone should Debug data migration script before next release,1
like Someone should Refactor the mobile layout by tomorrow,1
like Sakshi mentioned the login bug yesterday.,0
Nothing actionable at the moment.,0
so We need design approval first.,0
um Can someone Optimize user authentication by Friday?,1
We need more information before proceeding.,0
like No action items were mentioned.,0
so Please Migrate session management as soon as possible,1
um Can someone Improve data migration script due this week?,1
um There is no urgency for this item.,0
um Write the mobile layout for the next sprint please,1
so Someone updated the payment gateway earlier.,0
so Someone should Update API documentation as soon as possible,1
um Someone updated the payment gateway earlier.,0
like Please Integrate the notification service before next release,1
um Enhance data migration script needs to be done by tomorrow,1
uh There is no urgency for this item.,0
like Fix the monitoring dashboard by tomorrow,1
like There is no urgency for this item.,0
so Sakshi mentioned the login bug yesterday.,0
The team is still evaluating this.,0
uh Let's Resolve user authentication urgently,1
um The login bug was fixed previously.,0
so The database performance improved yesterday.,0
like Can someone Develop API documentation by Friday?,1
like There is no blocker right now.,0
Let’s wait for stakeholder feedback.,0
We should wait for product input.,0
like We should Design API documentation urgently,1
so It would be good to Build data migration script for the next sprint,1
uh We need design approval first.,0
like We need design approval first.,0
like Sakshi mentioned the login bug yesterday.,0
uh Enhance API documentation before next release,1
It would be good to Improve the caching layer,1
uh This will be discussed next week.,0
like Improve unit tests before next release please,1
um We will revisit this topic later.,0
um We should analyze this further.,0
so There is no urgency for this item.,0
uh We should Update onboarding screen by tomorrow,1
uh Integrate the search indexing logic for the next sprint please,1
um Arjun designed the onboarding screens last month.,0
We should Create onboarding screen due this week,1
um Configure logging system please,1
um Someone updated the payment gateway earlier.,0
like This decision is still pending.,0
like Someone should Integrate the login bug for the next sprint,1
um Let's Configure data migration script by tomorrow,1
like The login bug was fixed previously.,0
Someone should Develop logging system for the next sprint,1
Improve the analytics API as soon as possible,1
uh Someone should Update the recommendation engine urgently,1
so We will discuss this again tomorrow.,0
uh We should Create the recommendation engine by Friday,1
This will be discussed next week.,0
so Can someone Design the login bug due this week?,1
um Let’s wait for stakeholder feedback.,0
um We need to Fix onboarding screen,1
Let’s wait for stakeholder feedback.,0
like This decision is still pending.,0
like We should analyze this further.,0
like We need to Configure data migration script before next release,1
We will discuss this again tomorrow.,0
um The team optimized the caching layer before.,0
um This will be discussed next week.,0
Design the recommendation engine please,1
uh We need to Optimize the monitoring dashboard for the next sprint,1
like This depends on future planning.,0
um This requires additional approval.,0
We should Debug unit tests by Friday,1
um We should Build the analytics API,1
We will discuss this again tomorrow.,0
like Please Fix data migration script for the next sprint,1
so We should Enhance database performance for the next sprint,1
Please Write onboarding screen as soon as possible,1
uh We should Fix the analytics API before next release,1
so This is still under review.,0
like Let's Create the notification service by Friday,1
like Can someone Debug the recommendation engine by Friday?,1
uh Let's Add unit tests for the next sprint,1
so Let's Optimize the analytics API by tomorrow,1
um This will be discussed next week.,0
uh Can someone Enhance the caching layer by Friday?,1
like Please Build API documentation due this week,1
so Can someone Refactor API documentation by tomorrow?,1
so Someone should Update the notification service by tomorrow,1
Please Refactor the mobile layout urgently,1
uh Configure the search indexing logic for the next sprint,1
like Write unit tests by Friday please,1
like Someone should Implement logging system by tomorrow,1
uh Fix onboarding screen due this week please,1
um We need to Update database performance due this week,1
um Let’s wait for stakeholder feedback.,0
The team optimized the caching layer before.,0
um This is still under review.,0
so We need design approval first.,0
uh We need to Debug logging system urgently,1
so We need to Write API documentation by tomorrow,1
uh The database performance improved yesterday.,0
so The team optimized the caching layer before.,0
like Update data migration script urgently please,1
uh Please Patch the search indexing logic before next release,1
uh It would be good to Add the analytics API for the next sprint,1
um It would be good to Migrate database performance urgently,1
um It would be good to Fix the search indexing logic for the next sprint,1
so We need more information before proceeding.,0
uh The team is still evaluating this.,0
like The database performance improved yesterday.,0
um Someone should Develop session management before next release,1
so Mohit worked on database performance last sprint.,0
Create the caching layer urgently,1
like We need to Optimize the analytics API as soon as possible,1
so This is still under review.,0
uh It would be good to Implement the mobile layout for the next sprint,1
uh Implement session management by tomorrow,1
like This will be discussed next week.,0
so Integrate the caching layer as soon as possible please,1
uh We need to Enhance the search indexing logic urgently,1
The login bug was fixed previously.,0
um Create the search indexing logic needs to be done for the next sprint,1
so We should collect more data first.,0
um Migrate the payment gateway needs to be done for the next sprint,1
um The team is still evaluating this.,0
uh Implement onboarding screen needs to be done as soon as possible,1
Please Create the login bug urgently,1
so We need more information before proceeding.,0
so Can someone Fix onboarding screen by tomorrow?,1
like Configure the notification service by tomorrow,1
This depends on future planning.,0
like Can someone Fix the recommendation engine by Friday?,1
We will revisit this topic later.,0
like The database performance improved yesterday.,0
Someone should Refactor the payment gateway by tomorrow,1
um We should Optimize onboarding screen urgently,1
so The team is still evaluating this.,0
Someone should Enhance the payment gateway before next release,1
um Someone updated the payment gateway earlier.,0
uh We should analyze this further.,0
um Can someone Update the monitoring dashboard due this week?,1
uh Migrate the UI components by Friday,1
We should wait for product input.,0
so We can postpone this to next sprint.,0
so Arjun designed the onboarding screens last month.,0
uh It would be good to Debug data migration script by Friday,1
um Debug logging system,1
Improve the mobile layout needs to be done by Friday,1
uh It would be good to Migrate the mobile layout before next release,1
The team optimized the caching layer before.,0
um This requires additional approval.,0
so Improve the mobile layout by tomorrow please,1
It would be good to Develop the UI components for the next sprint,1
so The database performance improved yesterday.,0
um Improve the UI components needs to be done urgently,1
uh This decision is still pending.,0
like The database performance improved yesterday.,0
uh Someone should Write session management for the next sprint,1
like Enhance the search indexing logic needs to be done,1
uh Sakshi mentioned the login bug yesterday.,0
so Can someone Configure the monitoring dashboard?,1
um Let's Design the payment gateway by tomorrow,1
um Someone should Design the mobile layout by tomorrow,1
uh Please Create the notification service as soon as possible,1
uh Design user authentication please,1
um The login bug was fixed previously.,0
uh We should Write API documentation by Friday,1
so Create database performance for the next sprint please,1
like Please Add the search indexing logic as soon as possible,1
um The login bug was fixed previously.,0
so We will discuss this again tomorrow.,0
like We will revisit this topic later.,0
It would be good to Update the login bug by Friday,1
so We need more information before proceeding.,0
so This requires additional approval.,0
so Someone should Design API documentation for the next sprint,1
so It would be good to Patch session management urgently,1
um We should analyze this further.,0
so We should Optimize the payment gateway urgently,1
uh Please Fix the notification service due this week,1
um It would be good to Debug the notification service for the next sprint,1
so Can someone Write data migration script by Friday?,1
We should Patch the recommendation engine urgently,1
We should Optimize data migration script by Friday,1
like We should Enhance the mobile layout urgently,1
like Can someone Enhance the mobile layout?,1
This depends on future planning.,0
like We should Debug the login bug by Friday,1
um We need to Build the recommendation engine before next release,1
uh Please Improve the monitoring dashboard as soon as possible,1
so We need to Build database performance,1
uh We reviewed the API documentation last week.,0
um This will be discussed next week.,0
so Patch data migration script needs to be done due this week,1
um Let's Fix the caching layer for the next sprint,1
um We should analyze this further.,0
so We should collect more data first.,0
um Integrate onboarding screen needs to be done due this week,1
like We need to Integrate API documentation by Friday,1
like Nothing actionable at the moment.,0
Write the recommendation engine needs to be done due this week,1
uh Nothing actionable at the moment.,0
uh The team optimized the caching layer before.,0
We should wait for product input.,0
so Build logging system needs to be done due this week,1
so Add API documentation needs to be done urgently,1
um Someone should Develop the login bug by tomorrow,1
like Please Refactor the login bug by tomorrow,1
Let’s wait for stakeholder feedback.,0
um We reviewed the API documentation last week.,0
Nothing actionable at the moment.,0
uh We should Integrate the monitoring dashboard,1
like Resolve unit tests,1
uh Someone should Add the login bug,1
uh It would be good to Resolve the notification service for the next sprint,1
like Please Refactor the analytics API due this week,1
We need to Develop the notification service by tomorrow,1
Someone should Enhance the search indexing logic for the next sprint,1
uh Let's Add database performance by Friday,1
We need to Implement API documentation by Friday,1
so We need more information before proceeding.,0
Please Fix the monitoring dashboard before next release,1
like It would be good to Update the notification service as soon as possible,1
um We need to Debug session management by tomorrow,1
like Enhance API documentation needs to be done by Friday,1
like Someone should Enhance the UI components before next release,1
like Add data migration script,1
uh Update onboarding screen due this week,1
um Someone should Debug API documentation by Friday,1
uh Add API documentation as soon as possible please,1
uh Someone should Patch the notification service for the next sprint,1
uh The team optimized the caching layer before.,0
Let's Develop API documentation as soon as possible,1
uh Please Develop the UI components by Friday,1
uh Improve the payment gateway needs to be done urgently,1
Arjun designed the onboarding screens last month.,0
uh Let's Design session management for the next sprint,1
um Let’s wait for stakeholder feedback.,0
um Please Integrate data migration script due this week,1
like We need to Develop the mobile layout urgently,1
um We should analyze this further.,0
The database performance improved yesterday.,0
uh Nothing actionable at the moment.,0
so Someone updated the payment gateway earlier.,0
like It would be good to Patch the monitoring dashboard for the next sprint,1
so Can someone Enhance the notification service due this week?,1
so Let’s wait for stakeholder feedback.,0
like It would be good to Fix the search indexing logic due this week,1
like We need to Build user authentication due this week,1
