sentence,label
so This will be discussed next week.,0
No action items were mentioned.,0
uh Can someone Integrate the payment gateway?,1
so Someone should Add the caching layer due this week,1
We should collect more data first.,0
so Let's Patch the UI components due this week,1
like The team is still evaluating this.,0
like We need to Fix the login bug as soon as possible,1
This is still under review.,0
so We need more information before proceeding.,0
uh We will discuss this again tomorrow.,0
um This will be discussed next week.,0
uh We need to Add the caching layer as soon as possible,1
uh It would be good to Implement onboarding screen by tomorrow,1
um Let’s wait for stakeholder feedback.,0
so Please Write the caching layer due this week,1
Arjun designed the onboarding screens last month.,0
like We should Configure the payment gateway for the next sprint,1
um We need to Create user authentication by Friday,1
so Someone should Write the mobile layout as soon as possible,1
like Can someone Design database performance by tomorrow?,1
um Update the recommendation engine before next release,1
like Add the caching layer needs to be done before next release,1
uh The login bug was fixed previously.,0
Refactor API documentation as soon as possible,1
like Debug the analytics API needs to be done as soon as possible,1
um Update data migration script needs to be done before next release,1
uh Let's Fix the payment gateway as soon as possible,1
like This decision is still pending.,0
uh Integrate database performance needs to be done,1
so Someone should Integrate the login bug before next release,1
so Let's Integrate the mobile layout urgently,1
so Sakshi mentioned the login bug yesterday.,0
um We should analyze this further.,0
uh Someone should Debug the search indexing logic before next release,1
It would be good to Resolve data migration script urgently,1
um Someone should Debug session management due this week,1
uh We can postpone this to next sprint.,0
so Migrate user authentication by Friday,1
uh Update data migration script as soon as possible please,1
uh We need to Create logging system by Friday,1
so Configure unit tests urgently please,1
We need to Patch session management,1
Fix data migration script urgently,1
so The team is still evaluating this.,0
um Someone should Integrate the caching layer urgently,1
like The database performance improved yesterday.,0
like Someone should Migrate the login bug due this week,1
like The login bug was fixed previously.,0
so Someone should Fix the notification service by tomorrow,1
like Please Integrate onboarding screen due this week,1
We should Resolve the login bug as soon as possible,1
like We should collect more data first.,0
like We will revisit this topic later.,0
uh The team optimized the caching layer before.,0
um We should collect more data first.,0
so No action items were mentioned.,0
like This is still under review.,0
uh Design the analytics API for the next sprint,1
like The login bug was fixed previously.,0
This decision is still pending.,0
It would be good to Write user authentication urgently,1
Sakshi mentioned the login bug yesterday.,0
like This decision is still pending.,0
uh Please Design onboarding screen by Friday,1
like We should collect more data first.,0
like The login bug was fixed previously.,0
uh It would be good to Optimize the monitoring dashboard as soon as possible,1
um Add the notification service please,1
so We should collect more data first.,0
like Let's Patch the mobile layout as soon as possible,1
um We will revisit this topic later.,0
uh Nothing actionable at the moment.,0
We need to Write the recommendation engine before next release,1
uh Please Design logging system due this week,1
like Mohit worked on database performance last sprint.,0
Improve database performance needs to be done due this week,1
uh The database performance improved yesterday.,0
like The team optimized the caching layer before.,0
We should Migrate the analytics API due this week,1
Create the search indexing logic urgently,1
like We need to Resolve onboarding screen by Friday,1
so Sakshi mentioned the login bug yesterday.,0
It would be good to Refactor the recommendation engine for the next sprint,1
um The database performance improved yesterday.,0
like Add the search indexing logic urgently,1
Let's Improve database performance,1
um We should Fix the UI components before next release,1
uh Add user authentication,1
Let's Design the payment gateway before next release,1
so This decision is still pending.,0
um Can someone Configure the mobile layout urgently?,1
so We should wait for product input.,0
We reviewed the API documentation last week.,0
Let’s wait for stakeholder feedback.,0
uh We should Build session management by Friday,1
so Let's Create database performance by Friday,1
so Let's Fix the payment gateway by Friday,1
uh The database performance improved yesterday.,0
like We should Refactor the recommendation engine urgently,1
like We should Create the monitoring dashboard urgently,1
uh Someone should Debug the caching layer before next release,1
like There is no urgency for this item.,0
uh Resolve the recommendation engine needs to be done due this week,1
We need to Optimize the UI components by Friday,1
This is still under review.,0
um We should collect more data first.,0
uh Let's Integrate session management as soon as possible,1
like It would be good to Develop unit tests,1
like We reviewed the API documentation last week.,0
um The login bug was fixed previously.,0
so Please Optimize the monitoring dashboard due this week,1
Mohit worked on database performance last sprint.,0
like It would be good to Debug the caching layer urgently,1
um There is no urgency for this item.,0
um Improve the payment gateway by tomorrow,1
It would be good to Enhance user authentication as soon as possible,1
um Configure the mobile layout as soon as possible please,1
like Add database performance needs to be done by tomorrow,1
uh Fix logging system needs to be done by Friday,1
um There is no urgency for this item.,0
like It would be good to Enhance session management for the next sprint,1
uh Refactor the payment gateway needs to be done,1
um We need to Debug the analytics API by tomorrow,1
um Configure the recommendation engine needs to be done due this week,1
so Let's Write data migration script,1
uh Update data migration script needs to be done as soon as possible,1
like We should Develop the recommendation engine by Friday,1
like This will be discussed next week.,0
uh It would be good to Enhance the login bug,1
This decision is still pending.,0
like Please Improve database performance as soon as possible,1
uh We need to Integrate user authentication due this week,1
There is no blocker right now.,0
uh We should wait for product input.,0
The team is still evaluating this.,0
uh We will discuss this again tomorrow.,0
like We should Optimize unit tests due this week,1
It would be good to Integrate logging system as soon as possible,1
uh Mohit worked on database performance last sprint.,0
um It would be good to Enhance the search indexing logic as soon as possible,1
so This is still under review.,0
so Refactor the analytics API needs to be done urgently,1
This decision is still pending.,0
like Let's Debug the notification service,1
like We need more information before proceeding.,0
like We can postpone this to next sprint.,0
like Design the UI components as soon as possible please,1
so Let's Resolve database performance due this week,1
so Add logging system needs to be done for the next sprint,1
um Improve data migration script due this week,1
so Can someone Improve the mobile layout for the next sprint?,1
Please Develop the login bug before next release,1
um We need to Build the caching layer urgently,1
Implement unit tests for the next sprint,1
um We can postpone this to next sprint.,0
um It would be good to Patch API documentation by Friday,1
like We need to Develop the monitoring dashboard as soon as possible,1
um Someone should Design onboarding screen urgently,1
like Create the mobile layout needs to be done for the next sprint,1
um This requires additional approval.,0
like Let's Create the mobile layout as soon as possible,1
so Migrate the payment gateway for the next sprint,1
um We can postpone this to next sprint.,0
like Let's Optimize the notification service for the next sprint,1
um We should Migrate API documentation by Friday,1
uh We should Update the mobile layout as soon as possible,1
uh We need to Improve onboarding screen by Friday,1
uh Please Update the payment gateway,1
Can someone Optimize the analytics API before next release?,1
uh Let's Improve session management urgently,1
so Design onboarding screen needs to be done before next release,1
Integrate the monitoring dashboard urgently,1
We reviewed the API documentation last week.,0
so This depends on future planning.,0
so The database performance improved yesterday.,0
Write the recommendation engine needs to be done before next release,1
uh Please Update user authentication,1
Migrate the analytics API by Friday please,1
like It would be good to Fix user authentication before next release,1
It would be good to Build the recommendation engine,1
We need design approval first.,0
so Can someone Improve onboarding screen?,1
um It would be good to Patch session management before next release,1
um Someone updated the payment gateway earlier.,0
like We should wait for product input.,0
so Can someone Build the notification service urgently?,1
um Mohit worked on database performance last sprint.,0
uh This requires additional approval.,0
uh Migrate the analytics API before next release please,1
like Someone updated the payment gateway earlier.,0
uh It would be good to Build onboarding screen before next release,1
um This decision is still pending.,0
um Improve data migration script needs to be done for the next sprint,1
uh We need to Improve unit tests urgently,1
um We will revisit this topic later.,0
like This will be discussed next week.,0
uh We should Resolve the analytics API for the next sprint,1
um Someone updated the payment gateway earlier.,0
like We need more information before proceeding.,0
Mohit worked on database performance last sprint.,0
Let's Develop onboarding screen urgently,1
so Design the monitoring dashboard due this week,1
so We need more information before proceeding.,0
um Someone should Update the recommendation engine by Friday,1
Arjun designed the onboarding screens last month.,0
Can someone Implement unit tests due this week?,1
Can someone Create API documentation urgently?,1
so Patch unit tests needs to be done urgently,1
so Let's Build onboarding screen for the next sprint,1
um Someone updated the payment gateway earlier.,0
uh Can someone Enhance API documentation by tomorrow?,1
so This is not a priority currently.,0
uh This is not a priority currently.,0
um Someone should Refactor the login bug due this week,1
Mohit worked on database performance last sprint.,0
like Can someone Add the UI components as soon as possible?,1
Can someone Refactor the notification service by Friday?,1
um Can someone Debug the mobile layout urgently?,1
uh This is still under review.,0
so Let's Enhance the login bug,1
so This is not a priority currently.,0
uh We need design approval first.,0
um We need design approval first.,0
This is not a priority currently.,0
so We can postpone this to next sprint.,0
so The team optimized the caching layer before.,0
The login bug was fixed previously.,0
like Please Enhance onboarding screen as soon as possible,1
so Enhance session management by tomorrow,1
like We should Design unit tests urgently,1
It would be good to Refactor the caching layer as soon as possible,1
so Can someone Debug session management for the next sprint?,1
uh We need to Debug onboarding screen by Friday,1
uh This requires additional approval.,0
like Someone updated the payment gateway earlier.,0
so Optimize the mobile layout by tomorrow,1
Someone should Develop the mobile layout by Friday,1
so Refactor the mobile layout before next release please,1
like Resolve the caching layer needs to be done,1
um It would be good to Enhance onboarding screen due this week,1
uh It would be good to Enhance the recommendation engine,1
um It would be good to Integrate the mobile layout for the next sprint,1
um Someone should Configure data migration script as soon as possible,1
uh Mohit worked on database performance last sprint.,0
uh Someone should Update the UI components due this week,1
uh Design the search indexing logic by Friday,1
We need to Fix the recommendation engine by Friday,1
uh Migrate onboarding screen for the next sprint please,1
so Arjun designed the onboarding screens last month.,0
um We need to Enhance the monitoring dashboard by tomorrow,1
so Configure the analytics API needs to be done as soon as possible,1
Please Fix the UI components for the next sprint,1
like Someone should Migrate the notification service urgently,1
uh Can someone Refactor the mobile layout as soon as possible?,1
um Write the login bug by Friday,1
like Patch the caching layer by Friday,1
uh Design the payment gateway,1
Can someone Integrate onboarding screen for the next sprint?,1
um We should Add the caching layer as soon as possible,1
Let's Design the recommendation engine by Friday,1
Update logging system needs to be done by Friday,1
um Migrate the caching layer for the next sprint,1
so Please Design database performance as soon as possible,1
like We should Integrate logging system by tomorrow,1
so It would be good to Migrate onboarding screen by tomorrow,1
Someone should Migrate logging system by tomorrow,1
um This is still under review.,0
We can postpone this to next sprint.,0
so Configure the mobile layout,1
um We should Add the login bug by Friday,1
so We should Develop unit tests urgently,1
so Please Add the payment gateway,1
uh We need to Add the monitoring dashboard by Friday,1
um Someone should Resolve the caching layer by tomorrow,1
Someone should Improve the caching layer,1
uh We will discuss this again tomorrow.,0
It would be good to Optimize the mobile layout for the next sprint,1
um We reviewed the API documentation last week.,0
This is not a priority currently.,0
so This will be discussed next week.,0
Can someone Fix unit tests before next release?,1
Nothing actionable at the moment.,0
like Please Improve user authentication for the next sprint,1
It would be good to Enhance the login bug by Friday,1
This is not a priority currently.,0
like Someone should Create data migration script urgently,1
so Build the mobile layout needs to be done for the next sprint,1
The team optimized the caching layer before.,0
uh Implement unit tests by Friday,1
like Can someone Write logging system as soon as possible?,1
Someone should Improve onboarding screen by Friday,1
Someone updated the payment gateway earlier.,0
We should collect more data first.,0
um We need to Add the monitoring dashboard before next release,1
like The team is still evaluating this.,0
This requires additional approval.,0
so We should collect more data first.,0
um Let's Update the notification service,1
um This is still under review.,0
like We need more information before proceeding.,0
The team is still evaluating this.,0
um Improve the mobile layout needs to be done before next release,1
so We need to Resolve the notification service as soon as possible,1
like Sakshi mentioned the login bug yesterday.,0
like This decision is still pending.,0
like We will discuss this again tomorrow.,0
um We should wait for product input.,0
Optimize data migration script,1
um Design the UI components urgently,1
so We will revisit this topic later.,0
like Resolve logging system by tomorrow please,1
like Let’s wait for stakeholder feedback.,0
uh There is no blocker right now.,0
like We should collect more data first.,0
It would be good to Improve the monitoring dashboard as soon as possible,1
uh Nothing actionable at the moment.,0
We can postpone this to next sprint.,0
like It would be good to Configure logging system,1
uh It would be good to Add the notification service,1
like Please Develop the monitoring dashboard by Friday,1
uh It would be good to Update the monitoring dashboard due this week,1
so Arjun designed the onboarding screens last month.,0
so Let's Build data migration script before next release,1
um We should wait for product input.,0
um We need to Refactor the caching layer by Friday,1
Someone should Develop the search indexing logic for the next sprint,1
Someone updated the payment gateway earlier.,0
um Fix the recommendation engine by tomorrow please,1
like Please Optimize API documentation,1
uh It would be good to Build the UI components due this week,1
uh This is still under review.,0
uh Please Migrate session management before next release,1
so Create the login bug needs to be done before next release,1
We can postpone this to next sprint.,0
Let's Refactor onboarding screen urgently,1
so We should Integrate user authentication as soon as possible,1
This decision is still pending.,0
um It would be good to Optimize the notification service due this week,1
Let’s wait for stakeholder feedback.,0
um Develop the payment gateway needs to be done by tomorrow,1
um Can someone Implement the notification service as soon as possible?,1
uh The team is still evaluating this.,0
um Sakshi mentioned the login bug yesterday.,0
so Update the recommendation engine for the next sprint please,1
uh Please Fix unit tests before next release,1
so We should Create data migration script due this week,1
We should Optimize the analytics API by Friday,1
so Let's Fix the search indexing logic,1
uh The team optimized the caching layer before.,0
like We should Resolve onboarding screen for the next sprint,1
um Can someone Improve user authentication by Friday?,1
uh Can someone Update unit tests for the next sprint?,1
so There is no urgency for this item.,0
um We should Enhance the notification service urgently,1
like We should Refactor logging system by tomorrow,1
so Write database performance needs to be done by Friday,1
um It would be good to Fix the caching layer by Friday,1
Someone updated the payment gateway earlier.,0
uh It would be good to Enhance unit tests urgently,1
so We can postpone this to next sprint.,0
um It would be good to Patch unit tests as soon as possible,1
like The database performance improved yesterday.,0
so The database performance improved yesterday.,0
um Please Integrate the login bug before next release,1
Can someone Build unit tests for the next sprint?,1
Arjun designed the onboarding screens last month.,0
uh We should Resolve the search indexing logic as soon as possible,1
um Fix user authentication by tomorrow please,1
like It would be good to Implement database performance for the next sprint,1
so Please Integrate the search indexing logic before next release,1
uh Can someone Design data migration script as soon as possible?,1
so We can postpone this to next sprint.,0
like We should Implement the login bug as soon as possible,1
uh Someone updated the payment gateway earlier.,0
like It would be good to Write unit tests as soon as possible,1
so Can someone Resolve the UI components due this week?,1
uh Configure the caching layer needs to be done as soon as possible,1
um Add the payment gateway for the next sprint,1
um No action items were mentioned.,0
um It would be good to Improve API documentation,1
so Improve unit tests needs to be done due this week,1
so Nothing actionable at the moment.,0
um Develop the caching layer needs to be done before next release,1
like It would be good to Design the UI components as soon as possible,1
uh We need to Patch session management before next release,1
We should collect more data first.,0
um Arjun designed the onboarding screens last month.,0
Update the analytics API needs to be done by tomorrow,1
so The team is still evaluating this.,0
like It would be good to Improve the analytics API by tomorrow,1
like We should Develop database performance,1
uh Someone should Update the search indexing logic by Friday,1
like Nothing actionable at the moment.,0
like Enhance logging system please,1
We should collect more data first.,0
We should Implement API documentation by tomorrow,1
Let's Resolve the login bug urgently,1
like Let's Design database performance urgently,1
um Someone should Add the mobile layout urgently,1
so Debug the caching layer due this week,1
um This decision is still pending.,0
uh The database performance improved yesterday.,0
um Please Add data migration script as soon as possible,1
uh Let's Migrate API documentation before next release,1
um Enhance the search indexing logic due this week please,1
like We will revisit this topic later.,0
like We should analyze this further.,0
so Mohit worked on database performance last sprint.,0
Mohit worked on database performance last sprint.,0
We should Improve unit tests as soon as possible,1
This will be discussed next week.,0
so There is no blocker right now.,0
like There is no blocker right now.,0
um Configure the search indexing logic,1
um Please Patch the mobile layout by tomorrow,1
so Nothing actionable at the moment.,0
Can someone Implement the monitoring dashboard urgently?,1
The login bug was fixed previously.,0
like We will revisit this topic later.,0
so We can postpone this to next sprint.,0
like Let's Migrate the caching layer by Friday,1
uh Arjun designed the onboarding screens last month.,0
Update API documentation needs to be done,1
like Someone updated the payment gateway earlier.,0
like The team optimized the caching layer before.,0
This will be discussed next week.,0
uh Can someone Implement session management for the next sprint?,1
so Someone should Create the recommendation engine before next release,1
uh We need to Resolve data migration script by Friday,1
Mohit worked on database performance last sprint.,0
so Implement the UI components by Friday please,1
um Someone should Refactor the login bug for the next sprint,1
so Please Design database performance for the next sprint,1
so This will be discussed next week.,0
uh We should wait for product input.,0
like It would be good to Write session management as soon as possible,1
We reviewed the API documentation last week.,0
uh We need to Enhance session management due this week,1
The team optimized the caching layer before.,0
so Fix the payment gateway due this week,1
so Please Design the mobile layout due this week,1
um Mohit worked on database performance last sprint.,0
um Arjun designed the onboarding screens last month.,0
like Someone should Patch the notification service urgently,1
um Please Write the mobile layout urgently,1
uh Let's Debug unit tests due this week,1
We need to Develop the login bug by tomorrow,1
um Can someone Implement data migration script by Friday?,1
um This decision is still pending.,0
Develop unit tests please,1
like This depends on future planning.,0
uh Let's Optimize the mobile layout before next release,1
um Let’s wait for stakeholder feedback.,0
Can someone Design onboarding screen due this week?,1
so Build the recommendation engine due this week please,1
like The team optimized the caching layer before.,0
like Can someone Develop the UI components by tomorrow?,1
so Create the payment gateway before next release please,1
uh We will discuss this again tomorrow.,0
so We need design approval first.,0
like Design database performance due this week,1
um Arjun designed the onboarding screens last month.,0
so Someone should Write the analytics API as soon as possible,1
uh Can someone Add logging system urgently?,1
like This is not a priority currently.,0
um Please Create the analytics API due this week,1
like We should Migrate session management by Friday,1
so It would be good to Fix the caching layer due this week,1
sentence,label
Enhance the monitoring dashboard by tomorrow,1
Configure logging system as soon as possible,1
Improve the mobile layout urgently,1
This requires additional approval.,0
We need more information before proceeding.,0
This is still under review.,0
Fix session management by tomorrow,1
Resolve onboarding screen as soon as possible,1
We will revisit this topic later.,0
Improve the UI components as soon as possible,1
This requires additional approval.,0
Write logging system by tomorrow,1
Update logging system due this week,1
We need design approval first.,0
This decision is still pending.,0
Design unit tests,1
Optimize the caching layer by tomorrow,1
Build the notification service by Friday,1
We should collect more data first.,0
This will be discussed next week.,0
This depends on future planning.,0
We can postpone this to next sprint.,0
Create API documentation due this week,1
The team is still evaluating this.,0
Optimize the analytics API,1
This is still under review.,0
Nothing actionable at the moment.,0
This depends on future planning.,0
Enhance the caching layer,1
Enhance the recommendation engine,1
There is no blocker right now.,0
We should wait for product input.,0
Develop user authentication,1
Implement the analytics API urgently,1
Integrate the recommendation engine as soon as possible,1
The team is still evaluating this.,0
This decision is still pending.,0
Configure the caching layer by tomorrow,1
Write the UI components urgently,1
There is no blocker right now.,0
Nothing actionable at the moment.,0
Create logging system by Friday,1
Develop API documentation before next release,1
Create logging system due this week,1
There is no urgency for this item.,0
We need design approval first.,0
Integrate onboarding screen by Friday,1
Develop API documentation due this week,1
We can postpone this to next sprint.,0
We should analyze this further.,0
We should collect more data first.,0
This requires additional approval.,0
Enhance the mobile layout before next release,1
Update the login bug urgently,1
Write API documentation urgently,1
Build logging system as soon as possible,1
This depends on future planning.,0
Patch the caching layer by Friday,1
