sentence,label
um Integrate the login bug needs to be done by Friday,1
um It would be good to Migrate session management due this week,1
like Resolve the monitoring dashboard needs to be done by tomorrow,1
like It would be good to Create logging system as soon as possible,1
uh This is not a priority currently.,0
um Please Add database performance by Friday,1
like Build unit tests needs to be done by Friday,1
Can someone Develop logging system urgently?,1
This depends on future planning.,0
um Someone should Fix data migration script by Friday,1
um Please Enhance the recommendation engine for the next sprint,1
um This is still under review.,0
um Can someone Design the notification service by tomorrow?,1
uh Create the recommendation engine needs to be done urgently,1
uh Please Improve unit tests,1
Nothing actionable at the moment.,0
um We need to Develop the caching layer as soon as possible,1
uh Implement the payment gateway as soon as possible please,1
Debug API documentation needs to be done by Friday,1
so Please Implement onboarding screen before next release,1
so It would be good to Improve the monitoring dashboard for the next sprint,1
like Debug the analytics API needs to be done by tomorrow,1
uh Please Improve the analytics API urgently,1
like Refactor session management needs to be done due this week,1
uh The database performance improved yesterday.,0
so This is not a priority currently.,0
This is not a priority currently.,0
so Someone should Build the login bug before next release,1
Enhance the analytics API before next release,1
um Can someone Optimize onboarding screen due this week?,1
uh Let's Create onboarding screen by tomorrow,1
uh We should analyze this further.,0
uh Let's Debug data migration script due this week,1
like Nothing actionable at the moment.,0
so We should Fix database performance due this week,1
um It would be good to Migrate the analytics API,1
um Sakshi mentioned the login bug yesterday.,0
so Resolve the recommendation engine as soon as possible,1
uh We should Debug the recommendation engine by Friday,1
so The database performance improved yesterday.,0
so We should Migrate user authentication by Friday,1
so This decision is still pending.,0
so Let's Debug the notification service due this week,1
Build the recommendation engine before next release,1
um Refactor the notification service by tomorrow please,1
so Migrate data migration script needs to be done by Friday,1
um This depends on future planning.,0
so Let's Add onboarding screen by Friday,1
uh We should Optimize session management by Friday,1
uh Let's Improve onboarding screen due this week,1
like Let's Configure session management before next release,1
so Enhance the caching layer needs to be done for the next sprint,1
It would be good to Enhance the notification service urgently,1
uh There is no urgency for this item.,0
so Can someone Refactor the caching layer by Friday?,1
um Enhance the payment gateway by Friday,1
Please Build the payment gateway as soon as possible,1
um Fix the payment gateway for the next sprint please,1
so We should Improve unit tests by tomorrow,1
um We need design approval first.,0
Please Patch the login bug urgently,1
uh We can postpone this to next sprint.,0
Can someone Fix the UI components urgently?,1
Let’s wait for stakeholder feedback.,0
uh Improve session management by tomorrow,1
so Someone updated the payment gateway earlier.,0
um The database performance improved yesterday.,0
We need to Improve the monitoring dashboard due this week,1
uh We will discuss this again tomorrow.,0
um Someone should Implement the login bug before next release,1
uh Write the monitoring dashboard please,1
like Migrate the notification service before next release,1
um We should Design the search indexing logic as soon as possible,1
We need design approval first.,0
uh Someone updated the payment gateway earlier.,0
um This decision is still pending.,0
uh Can someone Integrate logging system before next release?,1
like We should collect more data first.,0
um Someone should Fix the caching layer due this week,1
uh Create the caching layer please,1
like This requires additional approval.,0
like Enhance user authentication urgently please,1
so It would be good to Debug the payment gateway for the next sprint,1
uh Can someone Build the search indexing logic by tomorrow?,1
uh There is no urgency for this item.,0
uh Please Implement onboarding screen for the next sprint,1
like This will be discussed next week.,0
Debug logging system urgently please,1
like Arjun designed the onboarding screens last month.,0
so We need design approval first.,0
uh Can someone Refactor onboarding screen urgently?,1
uh We need more information before proceeding.,0
Migrate onboarding screen urgently please,1
It would be good to Enhance the login bug for the next sprint,1
Someone should Design the UI components,1
like There is no urgency for this item.,0
Let's Improve the search indexing logic for the next sprint,1
We should analyze this further.,0
like We reviewed the API documentation last week.,0
uh Arjun designed the onboarding screens last month.,0
um Someone should Optimize session management for the next sprint,1
so We should wait for product input.,0
We will discuss this again tomorrow.,0
so There is no urgency for this item.,0
Please Implement onboarding screen urgently,1
so Can someone Design the caching layer by tomorrow?,1
We should collect more data first.,0
uh Implement data migration script urgently,1
This decision is still pending.,0
uh Can someone Design database performance urgently?,1
like Can someone Patch the caching layer by tomorrow?,1
like Can someone Resolve the notification service as soon as possible?,1
We need design approval first.,0
uh We should collect more data first.,0
um Let’s wait for stakeholder feedback.,0
so The login bug was fixed previously.,0
We will revisit this topic later.,0
We will revisit this topic later.,0
um There is no urgency for this item.,0
uh Patch the search indexing logic urgently please,1
so We need to Write the notification service,1
like Create data migration script needs to be done by Friday,1
like We need to Refactor the mobile layout by Friday,1
like We should Migrate database performance due this week,1
um Can someone Build API documentation by Friday?,1
like Sakshi mentioned the login bug yesterday.,0
We should collect more data first.,0
Someone should Configure the caching layer urgently,1
like The login bug was fixed previously.,0
so We can postpone this to next sprint.,0
um Develop the payment gateway by Friday,1
This is still under review.,0
um The login bug was fixed previously.,0
um We should collect more data first.,0
The login bug was fixed previously.,0
uh We should Migrate API documentation before next release,1
uh Can someone Improve unit tests due this week?,1
like We should Integrate the analytics API due this week,1
um We should Fix the login bug for the next sprint,1
uh There is no urgency for this item.,0
um Arjun designed the onboarding screens last month.,0
like Someone updated the payment gateway earlier.,0
Nothing actionable at the moment.,0
like We should analyze this further.,0
This requires additional approval.,0
so There is no urgency for this item.,0
um Please Debug database performance for the next sprint,1
like Refactor database performance before next release,1
uh Let's Design unit tests urgently,1
um Can someone Debug the recommendation engine?,1
This will be discussed next week.,0
uh The team optimized the caching layer before.,0
like Enhance the analytics API due this week please,1
uh Design onboarding screen,1
Add the login bug needs to be done before next release,1
like There is no blocker right now.,0
um We should wait for product input.,0
like There is no urgency for this item.,0
like Arjun designed the onboarding screens last month.,0
um We should analyze this further.,0
uh The database performance improved yesterday.,0
um Write the caching layer as soon as possible please,1
like Let’s wait for stakeholder feedback.,0
so We should wait for product input.,0
um Someone should Refactor unit tests urgently,1
uh We should Design API documentation before next release,1
We will revisit this topic later.,0
uh Sakshi mentioned the login bug yesterday.,0
um It would be good to Enhance the search indexing logic due this week,1
like Please Create data migration script for the next sprint,1
like Let's Refactor the search indexing logic before next release,1
like Arjun designed the onboarding screens last month.,0
so It would be good to Implement the login bug by Friday,1
like We need design approval first.,0
uh The login bug was fixed previously.,0
uh We should Create user authentication urgently,1
uh Let's Optimize the payment gateway due this week,1
so Please Create database performance for the next sprint,1
so Sakshi mentioned the login bug yesterday.,0
so We should wait for product input.,0
like There is no blocker right now.,0
like This is still under review.,0
like Build the UI components for the next sprint,1
like Patch data migration script before next release,1
like Please Refactor the login bug,1
It would be good to Create unit tests for the next sprint,1
There is no urgency for this item.,0
uh Design database performance as soon as possible please,1
like We should analyze this further.,0
like Please Integrate the search indexing logic due this week,1
uh We should collect more data first.,0
um There is no urgency for this item.,0
so Someone should Add the analytics API for the next sprint,1
uh This is still under review.,0
uh Mohit worked on database performance last sprint.,0
like Please Debug logging system,1
like Create the login bug by Friday please,1
um Can someone Create the UI components urgently?,1
like Let’s wait for stakeholder feedback.,0
uh It would be good to Configure the login bug by tomorrow,1
um Improve the notification service needs to be done by tomorrow,1
uh We reviewed the API documentation last week.,0
Design logging system needs to be done for the next sprint,1
so This depends on future planning.,0
like We can postpone this to next sprint.,0
uh Please Fix session management due this week,1
so Create onboarding screen for the next sprint,1
um This is still under review.,0
uh Can someone Develop the monitoring dashboard by Friday?,1
so Can someone Resolve unit tests for the next sprint?,1
so We should Improve the mobile layout before next release,1
like Design logging system needs to be done before next release,1
Refactor data migration script by tomorrow,1
so Let's Refactor the search indexing logic for the next sprint,1
uh We should Enhance the mobile layout,1
Can someone Patch unit tests before next release?,1
uh It would be good to Add the mobile layout by tomorrow,1
so There is no urgency for this item.,0
uh Please Create the analytics API as soon as possible,1
like We need to Patch the analytics API for the next sprint,1
um We should analyze this further.,0
uh Refactor onboarding screen as soon as possible please,1
so Can someone Integrate the recommendation engine urgently?,1
like We will discuss this again tomorrow.,0
um The database performance improved yesterday.,0
uh Integrate onboarding screen needs to be done urgently,1
so Can someone Resolve database performance due this week?,1
The team optimized the caching layer before.,0
um This requires additional approval.,0
so Someone updated the payment gateway earlier.,0
Can someone Improve the login bug before next release?,1
like We should Build logging system,1
like The login bug was fixed previously.,0
um We should analyze this further.,0
um We need to Resolve logging system,1
We should analyze this further.,0
like We should Build the UI components as soon as possible,1
so This decision is still pending.,0
um Please Resolve the login bug due this week,1
um We should analyze this further.,0
uh Nothing actionable at the moment.,0
It would be good to Create the caching layer as soon as possible,1
We need more information before proceeding.,0
uh We should collect more data first.,0
um Someone should Add the payment gateway for the next sprint,1
We need to Add the notification service due this week,1
like We should Enhance data migration script before next release,1
so Someone should Optimize data migration script due this week,1
like We should analyze this further.,0
uh Resolve user authentication needs to be done,1
uh Someone should Refactor logging system for the next sprint,1
like The login bug was fixed previously.,0
uh We should Optimize user authentication by Friday,1
It would be good to Update the recommendation engine due this week,1
uh Mohit worked on database performance last sprint.,0
like This decision is still pending.,0
so There is no blocker right now.,0
uh We will discuss this again tomorrow.,0
um It would be good to Integrate the caching layer by tomorrow,1
uh We need to Improve the caching layer before next release,1
uh We should Create session management urgently,1
so This is still under review.,0
uh Improve the mobile layout as soon as possible,1
so Nothing actionable at the moment.,0
so It would be good to Improve database performance for the next sprint,1
This will be discussed next week.,0
We need to Patch onboarding screen for the next sprint,1
like Can someone Migrate the mobile layout as soon as possible?,1
like No action items were mentioned.,0
um Can someone Build session management due this week?,1
so There is no urgency for this item.,0
uh Resolve unit tests by Friday please,1
uh Please Patch the recommendation engine urgently,1
There is no urgency for this item.,0
uh We should Create the search indexing logic as soon as possible,1
like The team optimized the caching layer before.,0
um Someone should Refactor session management by Friday,1
We should Migrate the caching layer due this week,1
so Someone should Implement session management urgently,1
so We will revisit this topic later.,0
like Can someone Patch logging system by Friday?,1
uh This depends on future planning.,0
uh We should Patch session management for the next sprint,1
uh Let’s wait for stakeholder feedback.,0
like Can someone Update the caching layer for the next sprint?,1
like Optimize unit tests needs to be done by tomorrow,1
so Please Debug the mobile layout by Friday,1
um It would be good to Patch user authentication for the next sprint,1
Implement the login bug as soon as possible,1
uh Someone should Add the monitoring dashboard urgently,1
like The team optimized the caching layer before.,0
so We should collect more data first.,0
so Please Patch the UI components urgently,1
so Someone should Migrate the analytics API before next release,1
It would be good to Configure the recommendation engine urgently,1
so Someone should Optimize onboarding screen before next release,1
uh This is not a priority currently.,0
like The database performance improved yesterday.,0
uh Build the notification service please,1
like Enhance data migration script needs to be done for the next sprint,1
uh Please Improve unit tests by tomorrow,1
so This requires additional approval.,0
so This decision is still pending.,0
uh We should Create the login bug before next release,1
like Fix the recommendation engine as soon as possible please,1
uh We need design approval first.,0
The login bug was fixed previously.,0
It would be good to Enhance the search indexing logic due this week,1
like Someone should Refactor the recommendation engine urgently,1
Let's Design user authentication by tomorrow,1
Add user authentication needs to be done,1
uh This is not a priority currently.,0
um We need to Add the search indexing logic by tomorrow,1
um Let's Configure the mobile layout before next release,1
like Debug user authentication urgently,1
um We should analyze this further.,0
um Improve logging system for the next sprint please,1
so Let's Optimize the search indexing logic by tomorrow,1
There is no urgency for this item.,0
like It would be good to Debug the recommendation engine by tomorrow,1
so We need to Configure API documentation by Friday,1
uh Someone updated the payment gateway earlier.,0
um We should wait for product input.,0
like Add data migration script needs to be done before next release,1
Sakshi mentioned the login bug yesterday.,0
so Integrate the mobile layout for the next sprint please,1
so Please Update onboarding screen,1
uh This is not a priority currently.,0
like It would be good to Write the caching layer for the next sprint,1
um Nothing actionable at the moment.,0
so The database performance improved yesterday.,0
um It would be good to Design the login bug by tomorrow,1
Please Create data migration script,1
so We need more information before proceeding.,0
so It would be good to Design the recommendation engine by tomorrow,1
so We need design approval first.,0
Someone should Debug the analytics API urgently,1
so This is not a priority currently.,0
like The team is still evaluating this.,0
like Implement the caching layer before next release,1
so Please Configure the search indexing logic as soon as possible,1
um Let's Patch session management before next release,1
like We need to Patch the notification service before next release,1
uh Let’s wait for stakeholder feedback.,0
like The login bug was fixed previously.,0
Design logging system due this week please,1
so Write the notification service needs to be done before next release,1
uh We need to Refactor user authentication for the next sprint,1
We will revisit this topic later.,0
Let's Build data migration script by Friday,1
uh We should Integrate database performance before next release,1
uh Can someone Add the payment gateway by tomorrow?,1
uh Please Migrate logging system for the next sprint,1
Please Enhance the notification service by Friday,1
so The team optimized the caching layer before.,0
like Enhance API documentation needs to be done,1
like We need to Improve the recommendation engine,1
so This will be discussed next week.,0
so Migrate the caching layer for the next sprint please,1
Someone should Design logging system by Friday,1
uh It would be good to Enhance the analytics API urgently,1
Let's Add user authentication by tomorrow,1
um This requires additional approval.,0
um It would be good to Resolve database performance urgently,1
like We should Update the mobile layout due this week,1
like Can someone Develop the analytics API by Friday?,1
uh It would be good to Debug user authentication,1
like We need to Refactor data migration script for the next sprint,1
um Someone should Write onboarding screen by tomorrow,1
like Can someone Add database performance before next release?,1
We need design approval first.,0
so Enhance the monitoring dashboard needs to be done for the next sprint,1
The login bug was fixed previously.,0
Someone should Integrate user authentication as soon as possible,1
Migrate the caching layer as soon as possible please,1
This depends on future planning.,0
so Sakshi mentioned the login bug yesterday.,0
so Improve the payment gateway as soon as possible please,1
Patch user authentication before next release please,1
um Fix unit tests needs to be done urgently,1
uh We need design approval first.,0
like This will be discussed next week.,0
like Someone should Develop the monitoring dashboard,1
uh Refactor the caching layer needs to be done for the next sprint,1
uh Nothing actionable at the moment.,0
We should Develop user authentication for the next sprint,1
um This decision is still pending.,0
Let's Enhance the search indexing logic by tomorrow,1
so Someone should Create unit tests as soon as possible,1
uh It would be good to Optimize onboarding screen as soon as possible,1
um Sakshi mentioned the login bug yesterday.,0
um We can postpone this to next sprint.,0
Someone should Fix API documentation by Friday,1
um We will revisit this topic later.,0
uh Implement the search indexing logic,1
um We should analyze this further.,0
um It would be good to Add onboarding screen due this week,1
like The login bug was fixed previously.,0
like The team optimized the caching layer before.,0
like We need design approval first.,0
uh The team is still evaluating this.,0
so The team optimized the caching layer before.,0
um It would be good to Configure the notification service by tomorrow,1
It would be good to Design the mobile layout,1
Please Migrate logging system by tomorrow,1
so We should Patch the payment gateway urgently,1
uh Please Add user authentication before next release,1
uh We will discuss this again tomorrow.,0
uh Please Integrate the recommendation engine urgently,1
uh Please Enhance data migration script,1
It would be good to Implement session management before next release,1
like We should Integrate data migration script,1
um Let's Design the recommendation engine before next release,1
so We need to Migrate the monitoring dashboard by Friday,1
um Resolve the login bug due this week please,1
um There is no urgency for this item.,0
uh The team is still evaluating this.,0
like We should collect more data first.,0
so We should collect more data first.,0
The login bug was fixed previously.,0
so There is no blocker right now.,0
uh Implement session management for the next sprint please,1
so We need to Refactor database performance urgently,1
like Resolve database performance urgently please,1
uh Optimize unit tests needs to be done by Friday,1
uh We will revisit this topic later.,0
um Please Optimize session management by tomorrow,1
so It would be good to Configure the login bug before next release,1
uh We will discuss this again tomorrow.,0
We should collect more data first.,0
so Design the mobile layout as soon as possible please,1
Let's Build the monitoring dashboard by Friday,1
We should Develop the mobile layout,1
um There is no blocker right now.,0
like No action items were mentioned.,0
so No action items were mentioned.,0
like This depends on future planning.,0
like This decision is still pending.,0
like Please Update the recommendation engine for the next sprint,1
uh This will be discussed next week.,0
like Can someone Build the search indexing logic due this week?,1
uh Resolve the login bug needs to be done,1
uh We need more information before proceeding.,0
so Please Optimize the notification service by tomorrow,1
This is not a priority currently.,0
um We need more information before proceeding.,0
so Let’s wait for stakeholder feedback.,0
Can someone Develop the recommendation engine?,1
um Patch user authentication before next release please,1
uh We need more information before proceeding.,0
like We should Debug session management as soon as possible,1
like Add database performance as soon as possible,1
like We should wait for product input.,0
like Integrate the analytics API by Friday,1
Someone should Enhance the login bug by tomorrow,1
This will be discussed next week.,0
uh Please Improve the login bug for the next sprint,1
um We should analyze this further.,0
uh Optimize the recommendation engine urgently please,1
like We should Create the monitoring dashboard urgently,1
There is no blocker right now.,0
uh Let's Design database performance,1
like Enhance the UI components by tomorrow please,1
so This depends on future planning.,0
um Someone should Patch the payment gateway by Friday,1
so We need more information before proceeding.,0
um Can someone Develop unit tests for the next sprint?,1
like Can someone Enhance data migration script before next release?,1
um This requires additional approval.,0
uh Can someone Optimize unit tests?,1
uh Integrate API documentation by Friday,1
This requires additional approval.,0
like Please Refactor the caching layer by tomorrow,1
like We should Optimize onboarding screen,1
like Mohit worked on database performance last sprint.,0
uh We need to Resolve the notification service urgently,1
uh We should Update the login bug before next release,1
um We need to Fix API documentation by tomorrow,1
like The team optimized the caching layer before.,0
um Mohit worked on database performance last sprint.,0
like The team is still evaluating this.,0
um Debug the search indexing logic urgently,1
We will revisit this topic later.,0
um Someone should Build the caching layer by tomorrow,1
uh It would be good to Build the analytics API,1
like Please Configure the notification service as soon as possible,1
like Let’s wait for stakeholder feedback.,0
so Arjun designed the onboarding screens last month.,0
so Let's Develop the search indexing logic for the next sprint,1
This decision is still pending.,0
Can someone Design database performance as soon as possible?,1
so We need to Create onboarding screen urgently,1
um We should Create unit tests,1
like We reviewed the API documentation last week.,0
like Mohit worked on database performance last sprint.,0
um Someone updated the payment gateway earlier.,0
um We need design approval first.,0
uh Please Optimize the analytics API urgently,1
um Can someone Create unit tests by tomorrow?,1
so Implement data migration script needs to be done as soon as possible,1
like Can someone Write data migration script before next release?,1
so Someone should Refactor the recommendation engine by Friday,1
so Someone should Integrate the caching layer due this week,1
so Please Refactor the payment gateway by Friday,1
so Update the recommendation engine,1
like We should Integrate the UI components by tomorrow,1
like We should Update session management as soon as possible,1
like Someone should Debug API documentation as soon as possible,1
so Update the login bug by tomorrow please,1
so Someone should Develop the login bug urgently,1
We need to Patch the caching layer urgently,1
The team optimized the caching layer before.,0
uh It would be good to Resolve the payment gateway by Friday,1
like Fix data migration script by Friday,1
um No action items were mentioned.,0
uh We need to Design the UI components due this week,1
so Someone should Create the caching layer before next release,1
so Patch the notification service due this week please,1
